{
  "schema_name": "local-budget-policy-store-state",
  "schema_version": "1.0.0",
  "current_policy_id": "sha256:1111111111111111111111111111111111111111111111111111111111111111",
  "current_revision": "2",
  "previous_policy_id": "sha256:2222222222222222222222222222222222222222222222222222222222222222"
}
